question;id;content
Kto to jest Prezes URE?;Art. 72_1997_348.txt;" Art. 21.  1. Zadania z zakresu spraw regulacji gospodarki paliwami i energią oraz promowania konkurencji realizuje Prezes Urzędu Regulacji Energetyki, zwany dalej ""Prezesem URE"".  2. Prezes URE jest centralnym organem administracji rządowej powoływanym  na okres 5 lat przez Prezesa Rady Ministrów.  3. Prezes URE może być odwołany przed upływem okresu, na który został powołany, w przypadku choroby trwale uniemożliwiającej wykonywanie zadań, rażącego naruszania swoich obowiązków, popełnienia przestępstwa stwierdzonego prawomocnym wyrokiem sądu lub rezygnacji.  4. Prezes URE wykonuje zadania, o których mowa w ust. 1, przy pomocy Urzędu Regulacji Energetyki zwanego dalej ""URE"".  5. Wiceprezesa URE powołuje i odwołuje, na wniosek Prezesa URE, Prezes Rady Ministrów.  6. Organizację i tryb pracy URE określa statut nadany przez Prezesa Rady Ministrów w drodze rozporządzenia. "
Czym jest uchwała budżetowa województwa?;Art. 92_1998_576.txt; Art. 64. 1. Uchwała budżetowa województwa składa się z budżetu województwa, ustaleń  dotyczących spraw, które, na podstawie Prawa budżetowego, pozostawiono do  uchwały sejmiku województwa, oraz spraw wskazanych przez sejmik województwa  w uchwale, o której mowa w art. 63 ust. 2. 2. Uchwała budżetowa może obejmować wydatki na wieloletnie programy  inwestycyjne, jeżeli:  1) dla każdego programu wieloletniego zostały przez sejmik województwa  odrębnie określone:  a) nazwa programu, jego cel i zadania, które będą finansowane z budżetu  województwa,  b) jednostka organizacyjna wykonująca program lub też koordynująca  wykonywanie programu,  c) okres realizacji programu i łączne nakłady finansowe,  d) wysokość wydatków w poszczególnych latach realizacji programu,  2) kolejne uchwały budżetowe będą obejmować nakłady na uruchomiony program  w wysokości umożliwiającej jego terminowe zakończenie,  3) zmiana kwot wydatków na realizację programu może być wyłącznie skutkiem  odrębnych uchwał sejmiku województwa zmieniających zakres wykonywania  tego programu lub wstrzymujących jego wykonywanie. 
Czym jest spis kontrolny?;Art. 18_1996_147.txt;" Art. 16.  1. Od dnia 26 czerwca do dnia 2 lipca 1996 r. w wylosowanych obwodach spisowych zostanie przeprowadzony spis kontrolny.  2. Spis kontrolny polega na sprawdzeniu kompletności przeprowadzonego spisu oraz prawdziwości i poprawności zapisów w kwestionariuszach spisowych.  3. Prezes Głównego Urzędu Statystycznego określi, w drodze zarządzenia, szczegółowy zakres oraz tryb przeprowadzenia spisu kontrolnego. Zarządzenie  podlega ogłoszeniu w Dzienniku Urzędowym Rzeczypospolitej Polskiej ""Monitor Polski"". "
Do jakiego leczenia ma prawo ubezpieczony?;Art. 15_2001_906.txt; Art. 31c. 1. Ubezpieczony ma prawo do leczenia szpitalnego na podstawie  skierowania lekarza ubezpieczenia zdrowotnego, jeżeli cel  leczenia nie może być osiągnięty poprzez leczenie ambulatoryjne,  z zastrzeżeniem art. 58 ust. 3.  2. Ubezpieczony ma prawo do wyboru szpitala spośród szpitali tego  samego poziomu referencyjnego, które zawarły umowę z Kasą Chorych.  Jeżeli ubezpieczony wybierze inny szpital wyższego poziomu  referencyjnego, Kasa Chorych obciąża go wynikającą stąd różnicą  kosztów.  3. Różnice kosztów, o których mowa w ust. 2, określa się porównując  średni koszt leczenia pacjenta na oddziałach danej specjalności w  szpitalach obu poziomów referencyjnych na obszarze działania Kasy  Chorych w poprzednim roku kalendarzowym.  4. Minister Zdrowia i Opieki Społecznej określi, w drodze  rozporządzenia, krajową sieć szpitali ustalając ich poziom  referencyjny w zależności od rodzaju udzielanych przez te szpitale  świadczeń zdrowotnych. 
Co jest podstawą prawną do egzekucji uposażenia funkcjonariusza na podstawie tytułów egzekucyjnych sądowych?;Art. 151_2001_298.txt; Art. 112. 1. Egzekucja z uposażenia funkcjonariusza na podstawie tytułów  egzekucyjnych sądowych i administracyjnych następuje odpowiednio  według przepisów o egzekucji sądowej lub egzekucji administracyjnej. 2. Potrąceń na podstawie dobrowolnych obciążeń uposażenia, o których  mowa w art. 111 ust. 1 pkt 3, i szczególnych przepisów ustawowych  dokonuje się w wysokości ustalonej przez funkcjonariusza w jego  zobowiązaniu lub w przepisach szczególnych, niezależnie od potrąceń  dokonywanych na podstawie tytułów egzekucyjnych sądowych i  administracyjnych. 3. Kwota uposażenia równa kwocie najniższego wynagrodzenia pracowników  za pełny miesięczny wymiar czasu pracy ustalonego przez ministra  właściwego do spraw pracy na podstawie Kodeksu pracy jest wolna od  potrąceń, z wyjątkiem potrąceń z tytułu świadczeń alimentacyjnych. 
Kto jest naczelnym organem administracji w sprawach dotyczących budowania autostrad?;Art. 71_1994_627.txt; Art. 2.  1. Minister Transportu i Gospodarki Morskiej jest naczelnym organem administracji  państwowej właściwym w sprawach przygotowania budowy i eksploatacji  autostrad. Przepis ten nie narusza uprawnień Ministra Gospodarki  Przestrzennej i Budownictwa, określonych przepisami prawa budowlanego.  2. Minister Transportu i Gospodarki Morskiej wydaje, w drodze rozporządzenia,  przepisy techniczno-budowlane dotyczące autostrad. 
Czyja opinia może być konieczna do rozdzielenia niewykorzystanych kwot połowowych?;Art. 73_2004_574.txt; Art. 21. Kwoty połowowe niewykorzystane po wydaniu decyzji, o której mowa w art. 15 ust. 1 pkt 1 i art. 20, minister właściwy do spraw rolnictwa może rozdzielić po zasięgnięciu opinii organizacji społeczno-zawodowych rybaków. 
Co można finansować z budżetu państwa?;Art. 18_2004_898.txt;" Art. 13. 1. Na zasadach określonych w przepisach o finansach publicznych, z budżetu  państwa można:  1) dofinansować prowadzenie badań dotyczących rolnictwa ekologicznego, w tym  wykonywanie analiz na zawartość substancji niedozwolonych do stosowania w  rolnictwie ekologicznym;  2) udzielać dotacji na dofinansowanie kosztów kontroli gospodarstw rolnych,  w których prowadzona jest produkcja metodami ekologicznymi. 2. Z budżetu państwa mogą być dofinansowywane działania promocyjne w rolnictwie  ekologicznym, w tym udział w targach krajowych i międzynarodowych, na  podstawie umów zawartych w trybie przepisów o finansach publicznych. "
Jaki jest przykładowy organ pomocniczy Delegata Rządu?;Art. 110_1994_592.txt;" Art. 8. 1. Organem pomocniczym Delegata Rządu jest Zespół do Spraw Wdrożenia Reformy  Administracji Publicznej w Województwie, zwany dalej ""Zespołem"". W skład  Zespołu wchodzą dotychczasowi wojewodowie mający siedziby na obszarze  województwa oraz inne osoby powołane przez Delegata Rządu. 2. Delegat Rządu wyznacza sekretarza Zespołu kierującego bieżącymi pracami  Zespołu. 3. Delegat Rządu może powoływać inne zespoły o charakterze opiniodawczodoradczym. 4. Obsługę merytoryczną, finansową, organizacyjno-prawną, techniczną i  kancelaryjno-biurową Delegata Rządu oraz Zespołu wykonuje dotychczasowy  urząd wojewódzki w mieście będącym siedzibą wojewody oraz inne  dotychczasowe urzędy wojewódzkie na obszarze województwa. "
Jakie warunki muszą być spełnione aby żołnierz pełniący czynną służbę wojskową mógł uczestniczyć w nabożeństwa w niedzielę bądź święta?;Art. 36_1995_482.txt; Art. 15.  1. Żołnierzom pełniącym czynną służbę wojskową zapewnia się możliwość uczestniczenia - poza terenem jednostek wojskowych - w nabożeństwach i czynnościach religijnych w niedziele i w święta, jeżeli w miejscowości stacjonowania  jednostki wojskowej lub w jej pobliżu znajduje się miejsce kultu  publicznego Kościoła i jeżeli nie koliduje to z ważnymi obowiązkami służbowymi.  2. Opiekę duszpasterską na terenie jednostek wojskowych dla żołnierzy, o których mowa w ust. 1, zapewniają duchowni Kościoła w terminach uzgodnionych  z dowódcami jednostek.  3. Duchownych, o których mowa w ust. 2, wyznacza Rada Synodalna w porozumieniu  z Ministrem Obrony Narodowej. 
Kiedy nie stosuje się postępowania uproszczonego?;Art. 682_1997_555.txt;" Art. 470. Postępowania uproszczonego nie stosuje się:  1) w stosunku do oskarżonego pozbawionego wolności w tej lub innej  sprawie, chyba że zastosowano zatrzymanie lub tymczasowe aresztowanie wobec ujętego na gorącym uczynku lub bezpośrednio  potem sprawcy przestępstwa z art. 157 § 2 i 3, art. 191 § 1, art. 216 § 1 i 2, art. 217 § 1, art. 257 i 288 § 2 Kodeksu karnego; przepisu art. 259 § 3 nie stosuje się,  2) jeżeli zachodzą okoliczności wymienione w art. 79 § 1. "
Kto zapewnia przestrzeganie zasad higieny w procesie produkcji żywności w zakładach ją produkujących?;Art. 61_2001_634.txt; Art. 28. 1. Przestrzeganie właściwej jakości zdrowotnej żywności oraz zasad higieny w  procesie produkcji i w obrocie żywnością w zakładach produkujących żywność  lub wprowadzających ją do obrotu jest zapewnione przez kontrolę wewnętrzną. 2. Kontrola wewnętrzna w zakładzie obejmuje czynności niezbędne dla  sprawdzenia:  1) prawidłowości przestrzegania warunków i zasad higieny w celu zapewnienia  właściwej jakości zdrowotnej środków spożywczych oraz materiałów i wyrobów  przeznaczonych do kontaktu z tymi artykułami w toku produkcji,  przechowywania i wprowadzania do obrotu,  2) oceny skuteczności systemu HACCP. 
Czy ogrody zoologiczne są zobowiązane do zgłoszenia do rejestru zwierząt zaliczanych do ssaków bądź płazów?;Art. 162_2004_880.txt;" Art. 64. 1. Posiadacz zwierząt, o których mowa w art. 61 ust. 1, zaliczonych do płazów,  gadów, ptaków lub ssaków, a także prowadzący ich hodowlę, jest obowiązany do  pisemnego zgłoszenia ich do rejestru. 2. Obowiązek zgłoszenia do rejestru, o którym mowa w ust. 1, nie dotyczy:  1) ogrodów zoologicznych;  2) podmiotów prowadzących działalność gospodarczą w zakresie handlu  zwierzętami, o których mowa w art. 61 ust. 1;  3) czasowego przetrzymywania zwierząt w celu leczenia i rehabilitacji. 3. Rejestr, o którym mowa w ust. 1, prowadzi starosta właściwy ze względu na  miejsce przetrzymywania zwierząt lub prowadzenia ich hodowli. 4. Rejestr, o którym mowa w ust. 1, powinien zawierać następujące dane:  1) datę:  a) dokonania wpisu,  b) dokonania zmiany danych wpisanych do rejestru,  c) wykreślenia z rejestru;  2) imię, nazwisko i adres albo nazwę i siedzibę posiadacza lub prowadzącego  hodowlę;  3) adres miejsca przetrzymywania zwierząt lub prowadzenia hodowli;  4) liczbę zwierząt posiadanych lub hodowanych;  5) nazwę gatunku w języku łacińskim i polskim, jeżeli polska nazwa istnieje;  6) datę, miejsce urodzenia lub wyklucia zwierzęcia;  7) datę wejścia w posiadanie zwierzęcia oraz źródło jego pochodzenia;  8) płeć zwierzęcia, jeżeli jest możliwa do ustalenia;  9) opis trwałego oznakowania zwierzęcia, jeżeli jest oznakowane;  10) cel przetrzymywania lub prowadzenia hodowli zwierzęcia;  11) numer i datę wydania:  a) zezwolenia na import zwierzęcia do kraju albo  b) zezwolenia na schwytanie zwierzęcia w środowisku albo  c) dokumentu wydanego przez powiatowego lekarza weterynarii,  potwierdzającego urodzenie zwierzęcia w hodowli albo  d) innego dokumentu stwierdzającego legalność pochodzenia zwierzęcia. 5. Obowiązek zgłoszenia do rejestru lub wykreślenia z rejestru powstaje z dniem  nabycia lub zbycia, wwozu do kraju lub wywozu za granicę państwa, wejścia w  posiadanie zwierzęcia, jego utraty lub śmierci. Wniosek o dokonanie wpisu lub  wykreślenia z rejestru powinien być złożony właściwemu staroście w terminie  14 dni od dnia powstania tego obowiązku. 6. Do wniosku o dokonanie wpisu do rejestru załącza się kopię dokumentu, o  kórym mowa w ust. 4 pkt 11. 7. W razie zmiany danych, o których mowa w ust. 4 pkt 2-11, przepis ust. 5  stosuje się odpowiednio. 8. Wpisanie do rejestru starosta potwierdza wydaniem zaświadczenia. 9. Podmioty, o których mowa w ust. 2 pkt 2, są obowiązane do posiadania i  przekazania wraz ze sprzedawanym zwierzęciem oryginału lub kopii dokumentu, o  którym mowa w ust. 4 pkt 11. Kopia ta powinna być, przez podmiot sprzedający  zwierzę, zaopatrzona w numer nadawany według numeracji ciągłej, datę  wystawienia, pieczęć i podpis osoby sprzedającej, informację o liczbie  zwierząt, dla których została wystawiona, a jeżeli kopiowany dokument dotyczy  więcej niż jednego gatunku, także o ich przynależności gatunkowej. 10. Koszty związane ze znakowaniem, zgodnym z przepisami prawa Unii  Europejskiej, zwierząt, o których mowa w ust. 1, pokrywa posiadacz zwierzęcia  lub prowadzący hodowlę.  Rozdział 3  Ogrody botaniczne, ogrody zoologiczne oraz ośrodki rehabilitacji zwierząt "
Jaki jest przykład służb prowadzących dochodzenie w sprawie wykroczeń skarbowych?;Art. 191_1999_930.txt;" Art. 134.  § 1. Dochodzenie prowadzą także:  1) Straż Graniczna - w sprawach o przestępstwa skarbowe i wykroczenia  skarbowe wymienione w art. 133 § 1 pkt 1, ujawnione w zakresie swego  działania przez Straż Graniczną,  2) Policja - w sprawach o przestępstwa skarbowe i wykroczenia skarbowe  ujawnione w zakresie swego działania przez Policję,  3) Urząd Ochrony Państwa "" w sprawach o przestępstwa skarbowe ujawnione w  zakresie swego działania przez ten urząd,  4) Żandarmeria Wojskowa - w sprawach o przestępstwa skarbowe i wykroczenia  skarbowe popełnione przez osoby wymienione w art. 53 § 36.  § 2. Organy określone w § 1 pkt 1-3 zawiadamiają niezwłocznie o prowadzeniu  dochodzenia właściwe finansowe organy dochodzenia przez przesłanie odpisu  postanowienia o jego wszczęciu, chyba że ograniczą swoje czynności  do zabezpieczenia śladów i dowodów przestępstwa skarbowego lub wykroczenia  skarbowego oraz przekazania sprawy do dalszego prowadzenia tym organom.  § 3. Organ określony w § 1 pkt 4 o wszczęciu dochodzenia zawiadamia  niezwłocznie właściwą prokuraturę wojskową.  § 4. W razie zgłoszenia przez sprawcę czynu zabronionego wniosku o zezwolenie  na dobrowolne poddanie się odpowiedzialności, przekazanie sprawy  właściwemu finansowemu organowi dochodzenia jest obowiązkowe.  § 5. Przepisy § 1, 2 i 4 stosuje się odpowiednio w wypadku, gdy organ określony  w § 1 pkt 1-3 jest właściwy do prowadzenia dochodzenia w sprawie o czyn  zabroniony będący przestępstwem określonym w przepisach karnych innej  ustawy, który wyczerpuje zarazem znamiona przestępstwa skarbowego lub  wykroczenia skarbowego. "
Czy w czasie trwania spółki wolno zwrócić wspólnikom 70% wkładów?;Art. 633_1996_465.txt; Art. 189.  §1. W czasie trwania spółki nie wolno zwracać wspólnikom wniesionych wkładów  tak w całości, jak i w części, chyba że przepisy niniejszego działu  stanowią inaczej.  §2. Wspólnicy nie mogą otrzymywać z jakiegokolwiek tytułu wypłat z majątku  spółki potrzebnego do pełnego pokrycia kapitału zakładowego. 
Jaki jest maksymalny okres na który wojewoda może zająć nieruchomość w przypadku usuwania szkód spowodowanych siłą wyższa?;Art. 7_1997_493.txt; Art. 6.  1. W przypadku usuwania szkód spowodowanych siłą wyższą, których powstaniu  nie można było zapobiec, odpowiednio wojewoda albo rada gminy - mogą zezwolić na czasowe zajęcie nieruchomości na okres nie dłuższy niż 6 miesięcy.  2. W przypadku konieczności nabywania nieruchomości niezbędnych do wykonania  robót drogowych związanych z usuwaniem skutków powodzi z lipca  1997 r. mają odpowiednio zastosowanie przepisy art. 29-32 ustawy z dnia 27 października 1994 r. o autostradach płatnych (Dz.U. Nr 127, poz. 627, z 1996 r. Nr 106, poz. 496 i Nr 156, poz. 775) z tym, że kompetencje Prezesa Agencji Budowy i Eksploatacji Autostrad wykonuje właściwy terytorialnie  naczelny dyrektor okręgu dróg publicznych. 
